data,score,thumbsUpCount,problem_report,feature_request,irrelevant,ori_lang,app
Génial,5,0,0,0,1,fr,Garmin Connect
Super rien n'a dire,4,0,0,0,1,fr,Garmin Connect
Impossible de coupler une montre ou alors grosse difficultés à le faire quand cela veut bien marcher . Que dire des des entraînements qui ne se transfert pas sur la montre.,1,0,1,0,0,fr,Garmin Connect
No possibility to edit activity exercises after download since last update.,2,0,1,0,0,fr,Garmin Connect
Au top merci garmin,5,0,0,0,1,fr,Garmin Connect
Appli utile et bon design,5,0,0,0,1,fr,Garmin Connect
l'application ne fonctionne plus pour moi depuis la MAJ du 29 mai,1,0,1,0,0,fr,Garmin Connect
Très bien,5,0,0,0,1,fr,Garmin Connect
"Appli complète, claire et compatible avec les autres appli sportives. Un regret: pas de possibilité de se fixer un objectif annuel et d'en suivre l'évolution. Seuls des stats sur 12 mois glissants sont proposées.",4,1,0,1,0,fr,Garmin Connect
"Depuis la dernière mise à jour, transfert de données très complexes voir impossibles sur mon téléphone. Je vais jeter ma Garmin à la poubelle mais avant je vais l'écraser avec un marteau. Ensuite je reprendrai ma bonne vieille montre à aiguilles. Et pour les activités sportives, à l'ancienne et je vais plus penser du mal. J'encourage tout le monde a la même chose que moi... Apprendre à se connaître au travers de ses propres expériences et sensations plutôt que de répondre bêtement aux systèmes..",1,19,1,0,0,fr,Garmin Connect
"Impossible de coupler un Vivo smart 3 avec un téléphone (essayer avec Huawei, iPhone, Sony)!!!",1,0,1,0,0,fr,Garmin Connect
Impossible de configurer ma vivofit 3 sur mon huawei ! Nul,1,0,1,0,0,fr,Garmin Connect
De la misère avec le GPS,2,0,1,0,0,fr,Garmin Connect
Depuis la dernière mise à jour j'arrive enfin à recevoir les notifications  et contrôler ma musique sur deezer depuis ma vivoactive 3. J'en conclu que  les problèmes de connexion avec mon Xiaomi Redmi 4x sont résolus. C'est  quand même plus agréable comme ça !,4,8,0,0,1,fr,Garmin Connect
Magnifica,5,0,0,0,1,fr,Garmin Connect
Beaucoup trop de problèmes de synchro avec la montre,1,1,1,0,0,fr,Garmin Connect
"Tous les 2 mois, problème sur la fenix 6 pro de synchronisation concernant la musique avec ce message ""écoute hors connexion, impossible, veuillez mettre à jour"" même lorsque ça vient d'être fait par le tel et par l'ordi !",1,0,1,0,0,fr,Garmin Connect
Parfait et intuitif,4,0,0,0,1,fr,Garmin Connect
Super,5,0,0,0,1,fr,Garmin Connect
"Comme presque tout le monde suis fan de Garmin... Mais les mises à jour des montres c'est une catastrophe !! Depuis la dernière, ma vivoactive 4 se prend pour une Apple watch !! Même pas 1j d'autonomie contre 3 avant la Maj... Et 7 quand je l'ai acheté",1,5,1,0,0,fr,Garmin Connect
Au top,5,0,0,0,1,fr,Garmin Connect
L'application ne tient pas compte de tous les sports que l ont fait dans la journée.,2,0,1,0,0,fr,Garmin Connect
"Ai reçu la forerunner 620 pour noel, tres bon produit mais impossible de la connectée au téléphone.... Essayé sur d'autres téléphones, et c'est pareil...",2,3,1,0,0,fr,Garmin Connect
Permets d avoir une vue globale des activités et de la qualité de celles-ci,5,0,0,0,1,fr,Garmin Connect
"J'utilisais garmin connect avec mon smartphone et ma fenix 3 et depuis la mise à jour un message apparaît ""un problème est survenu lors de la tentative de connections à garmin connect"" et pas de réponse du service technique garmin je suis très déçu de garmin",2,0,1,0,0,fr,Garmin Connect
Les notifications d'un téléphone Samsung vers la montre fonctionne pas,2,0,1,0,0,fr,Garmin Connect
"Rien à dire, j'utilise cette application depuis 2 ans avec les différents gps que j'ai eu, toujours satisfait",5,0,0,0,1,fr,Garmin Connect
Utilisé avec Garmin 520,4,0,0,0,1,fr,Garmin Connect
Super,5,0,0,0,1,fr,Garmin Connect
"Un peu de difficultés pour la mise en place des informations que l'on souhaite suivre, ensuite... rien à redire pour l'instant, très ludique",4,0,0,1,0,fr,Garmin Connect
Nouveau Samsung S8 et impossible de syncrho ma Garmin Fenix5. Ca fonctionnait très bien sur mon vieux iPhone. Au prix du matos je suis furieux.,1,0,1,0,0,fr,Garmin Connect
Au top. Il manque quand même la possibilité de partager un entraînement créé. Sinon top.,4,0,0,1,0,fr,Garmin Connect
Descend la batterie très très vite même éteint en tâche de fond.,1,1,1,0,0,fr,Garmin Connect
"Application peu intuitive, qui présente beaucoup de lacunes. Par exemple, à la fin d'une activité, lorsque je veux ajouter des photos à partir de mon téléphone, l'application ne me donne pas l'option d'aller chercher mes photos dans le bon dossier... Et donc je n'arrive pas à y mettre mes photos. De plus, l'application plante souvent. Les paramètres sont peu intuitifs.",1,10,1,1,0,fr,Garmin Connect
"Installation impossible via mon smartphone & facebook connect, il aura fallu attendre d'être sur mon laptop de retour de voyage pour avoir un début de synchronisation... dans l'attente de voir ce que donne l'application, pour le moment je regrette le manque de simplicité et d'efficacité de la part de l'application... Vais-je pouvoir synchroniser mes anciens chronos via ma Garmin Forerunner",3,7,0,1,0,fr,Garmin Connect
Satisfait et contant avec Garmin 235 appli excellente (excepté les bugs)  mais c'est du passé,4,0,0,0,1,fr,Garmin Connect
Top,4,0,0,0,1,fr,Garmin Connect
"J'ai longtemps eu du Polar. Je suis passé il y a quelques années à Garmin. Je ne le regrette pas. S'il m'est difficile de comparer les logiciels - en particulier les applis Smartphone, qui n'existaient pas - je suis en revanche pleinement satisfait de Connect.",5,24,0,0,1,fr,Garmin Connect
"Depuis la dernière mise à jour, mon tracker, bien que connecté au gps, n'assure plus la mesure km. Il serait judicieux de proceder à la remise en ligne d'une version de l'application antérieure fonctionnelle, ou d'assurer un correctif rapidement ... A defaut je reprendrai ma très classieuse steel serie de within (nokia).",5,7,1,0,0,fr,Garmin Connect
"Utilisation intuitive, interface très ergonomique, fonctionnalités diversifiées et complètes... le ""gadget"" ultime du sportif souhaitant décrypter ses entraînements et même la qualité de son sommeil!",5,0,0,0,1,fr,Garmin Connect
"Elle est fonctionnelle et apporte des compléments d'informations utiles sur les activités sportives et quotidiennes. Par contre, ceux qui n'ont pas un bon teléphone passez par le site internet car c'est une appli qui nécessite beaucoup de mémoire sinon elle plante et du coup fait planter la montre (sur mon ancien téléphone l'appli plantait tout le temps, donc impossible de l'utiliser)",4,17,1,0,0,fr,Garmin Connect
Après contact avec Garmin l'appli bug sous la dernière version d'Android 7 selon leur dire la résolution du problème peu encore prendre du temps 😒 à méditer la réponse en gros ben tu paye et t'attend donc mesdames messieurs pour Noël éviter Garmin,3,1,1,0,0,fr,Garmin Connect
Voilà depuis la dernière mise à jour tout est rentré dans l'ordre Application très pratique,5,4,0,0,1,fr,Garmin Connect
Trop bien merci pour cette appli,5,0,0,0,1,fr,Garmin Connect
"Malgré la mise à jour, toujours impossible de synchroniser ma Vivoactive 3 Music avec un OnePlus 7T Pro.",1,2,1,0,0,fr,Garmin Connect
Très bien pensée cette appli. Manque juste un peu clarté par moment comment pour le calcul des minutes intensives. Il manque également certains sport comme la boxe par ex. Vive le sport!!!,4,2,0,1,0,fr,Garmin Connect
"En solo ou avec partenaires, sa remotive pour l'entraînement 👍👍",5,0,0,0,1,fr,Garmin Connect
Cette non intégration est un scandale pour une montre à 500€... Et un faute marketing... faut il acheter une Suunto ?,1,0,1,0,0,fr,Garmin Connect
"Pour un novice, cette application est très bien faite, très complète, et surtout très motivante",4,0,0,0,1,fr,Garmin Connect
Top ça me motive pour continuer ma vie sportive,5,0,0,0,1,fr,Garmin Connect
👍,5,0,0,0,1,fr,Garmin Connect
"Très bonne application, avec énormément d'informations sur les activités. 2 éléments qui pourraient être améliorés : retrouver le suivi des objectifs que l'on se fixe (sur la version web, 15 km de course de tel à tel jour - que je ne trouve pas sur l'appli) et intégrer sur nos charges entraînements un don du sang pour en suivre l'impact (je ne sais pas comment ça pourrait être possible) mais nos capacités physiques sont impactées et ce serait chouette de pouvoir le suivre plus précisément. Merci",5,17,0,1,0,fr,Garmin Connect
Échec de connexion. ..  quand ce problème sera résolu?,1,0,1,0,0,fr,Garmin Connect
"Super applications, motivante et on peut mieux s'améliorer avec cette appli car on n'a plien de statistiques.",5,0,0,0,1,fr,Garmin Connect
Parfait pour le suivi de mes entraînements Les différents suivis des activités sont très complets.,5,0,0,0,1,fr,Garmin Connect
"Tres claire, lisible et intuitive, l'application et sa synchronisation automatique avec une montre Garmin est un modèle du genre. Rien ne manque et tout comme les montres du constructeur c'est très précis et fiable. Well done Garmin 😉",5,0,0,0,1,fr,Garmin Connect
Super produit,5,0,0,0,1,fr,Garmin Connect
"Je l'utilise tous les jours. Simple, facile, efficace. 😊",5,1,0,0,1,fr,Garmin Connect
👏👏Bravo bravo et merci pour la mise à jour 4.32 du 24 juin 2020 qui permet de nouveau aux appareils Garmin Edge 1000 de pouvoir faire un live track. Depuis la mi-avril j'attendais cette mise à jour efficace. Encore une fois merci et bravo,5,22,0,0,1,fr,Garmin Connect
L'application ne trouve pas ma vivofit et quand elle daigne bien vouloir m'afficher le code je ne sais pas confirmer et elle relance automatiquement une nouvelle recherche...!! On fait quoi dans ce cas là? !?!,2,18,1,0,0,fr,Garmin Connect
"La précédente montre que j'avais (une entrée de gamme) était beaucoup plus précise. Sans sortir de chez moi, celle-ci (que j'utilise depuis 8 mois) indique que je fais entre 8000 et 10 000 pas par jour! Je me brosse les dents? Hop ! Des centaines de pas en plus... Je fais la vaisselle, rebelote ! J'ai un sommeil très profond. Cette montre me dit que j'ai 30mn de sommeil profond en moyenne, par contre 2h de sommeil paradoxal! Exactement l'inverse de la réalité. Je suis extrêmement déçue...",2,1,1,1,0,fr,Garmin Connect
"Les différentes mise à jour ont réglé les problèmes de synchronisation, les plantages et autres bugs... L'application est devenue plus agréable à utiliser au quotidien.",5,12,0,0,1,fr,Garmin Connect
"Depuis plusieurs années et après l'acquisition de plusieurs appareils Garmin, j'apprécie de suivre mes statistiques et l'évolution des données au fil des années. Sans être un grand sportif, je suis plutôt régulier dans mes activités et cette application est une bonne approche pour un suivi de ma santé.",5,2,0,0,1,fr,Garmin Connect
"Encore une mise à jour surtout esthétique et je vois toujours pas comment mettre la vitesse en km/h plutôt que l'allure, du coup je transfert toutes mes données chez polar pour voir mes données c'est le comble. D'ailleurs même dans le site ça se remet systématiquement sur allure.",3,0,0,1,0,fr,Garmin Connect
I have to install an update on a weekly basis. Waste of my time,1,0,0,0,1,fr,Garmin Connect
"EDIT: la dernière version ne me permet plus de synchroniser les activités  de ma forerunner 220. Il faut que je supprime la montre dans l'application  et que je la rajoute. Bref, c'est inutilisable.",1,3,1,0,0,fr,Garmin Connect
Beaucoup de problèmes pour connecter la vivoactive hr. Connexion bluetooth seulement par miracle avec android.Déçu,3,0,1,0,0,fr,Garmin Connect
Fonctionne très bien et est très précise mais cela dépend de la montre,5,0,0,0,1,fr,Garmin Connect
Énorme problème avec la maj du 07/12 ou comment flinguer une image de marque juste en période achat de noël,1,3,1,0,0,fr,Garmin Connect
"Que vous soyez victime d'une attaque informatique, c'est malheureusement courant actuellement. Qu'on ne puisse plus synchroniser le téléphone avec votre site, c'est logique dans cette situation. Mais comment justifiez vous qu'on ne puisse plus du tout synchroniser la montre avec le téléphone ?! Au point de transformer nos montres en Casio des années 80!!! Et arrêtez de nous harceler avec des notifications pour des autorisations qu'on ne veut pas donner...",1,29,1,1,0,fr,Garmin Connect
"Gros problème depuis la dernière mise à jour, impossible de consulter les activités",4,1,1,0,0,fr,Garmin Connect
Trop de soucis de synchronisation entre edge 810 et smartphones Huawei p9. Problème connu par Garmin sans que rien ne soit fait...,1,0,1,0,0,fr,Garmin Connect
"Très bonne appli, pratique et rapide. Seul bémol, la fonction de création d'itinéraire et de suivi, qui bug régulièrement et qui fait passer pour des routes en vélo de route impraticables (pour vtt). Sinon, top top top",4,6,1,0,0,fr,Garmin Connect
L'application restitue très bien les différentes activités mais elle manque cruellement d'intérêt sur l'exploitation des données. Par exemple le graphique de temps passé dans les différentes zones de FC n'existe pas pour tous les appareils alors qu'il s'agit d'une simple restitution.,3,0,0,1,0,fr,Garmin Connect
Application sympa GPS OK,4,0,0,0,1,fr,Garmin Connect
Géniale!,5,0,0,0,1,fr,Garmin Connect
Excellent,5,0,0,0,1,fr,Garmin Connect
Application excellente...si ce n'est des pbs de bug lors de la synchronisation des données avec le WI-FI....IMPOSSIBLE....idem avec la connexion BLUETOOTH....Obligations de transférer les données en connectant ma 920XT au PC  par USB.... 😕,4,0,1,0,0,fr,Garmin Connect
Super application,5,0,0,0,1,fr,Garmin Connect
Un peu gadget mais du fun,4,0,0,0,1,fr,Garmin Connect
Déçu 😢,1,0,0,0,1,fr,Garmin Connect
J avais déjà eu des problème avec ma vivofit... Maintenant impossible d appairer ma nouvelle acquisition ! Vraiment dommage car produits aux tops mais appli vraiment pas a la hauteur. ..,1,1,1,0,0,fr,Garmin Connect
Depuis 47h impossible de synchroniser mon Nexus5 et mon vivosmart...,2,1,1,0,0,fr,Garmin Connect
"Très bonne application, il y a beaucoup de détails pour vos séances d'entraînements.",4,0,0,0,1,fr,Garmin Connect
"Depuis  là dernière mise à jour, impossible de synchroniser la montre et application Garmin connect",3,3,1,0,0,fr,Garmin Connect
ATTENTION La dernière version de connect ne fait plus les notifications  orales de vitesse allure fc ce qui est complètement pénalisant.  Le support n arrive pas à reproduire le pb. Cas vu avec forerunner 235. Dans l'attente  d'un fixe rapide et d'une meilleure qualité de l'application,3,8,1,0,0,fr,Garmin Connect
La 620 est enfin reconnue par les smartphones sous Android.  Bravo aux développeurs.,5,0,0,0,1,fr,Garmin Connect
"Je confirme, alors que je n'avais aucun problème depuis 1 an sur le fonctionnement de l'application et de la montre, depuis la dernière mise à jour, impossible de me servir de ma montre: pas de synchronisation possible donc, aucun lien entre mon téléphone (Samsung) et la montre que je n'arrive même pas à mettre à l'heure !",1,23,1,0,0,fr,Garmin Connect
Très précis et complet,5,0,0,0,1,fr,Garmin Connect
Simple d'utilisation et très efficace ! Je recommande,5,0,0,0,1,fr,Garmin Connect
Très bien fait le job!,5,0,0,0,1,fr,Garmin Connect
"Parfait pour moi, c'est exactement ce qu'il me fallait !",5,0,0,0,1,fr,Garmin Connect
"Plein de données utiles (sommeil, cycle menstruel, calories, etc.). Simple à utiliser:)",5,0,0,0,1,fr,Garmin Connect
Utilisation tout les jours. Ma aidé a reprendre mon activité de course a pied.,4,0,0,0,1,fr,Garmin Connect
"Super Appli, nombreuses fonctionnalités et possibilités avec sa communauté !",5,0,0,0,1,fr,Garmin Connect
Très lisible et connexion aisée. Donne de bonnes indications.,5,0,0,0,1,fr,Garmin Connect
Une bonne application Cependant aujourd'hui après mise à jour de la montre connectée HR impossible d afficher le français !,4,0,1,0,0,fr,Garmin Connect
"Suivi du sommeil, peut toujours être amélioré. N'enregistre pas, ne permet pas, d'enregistrer les périodes de sieste. Bracelet résistant, très bonne tenue une fois chargé. Interface pratique , lisible.",4,0,0,1,0,fr,Garmin Connect
"Beaucoup plus pratique que l'application Polar, on peut notamment rentrer les entraînements que l'on fait sans montre (notamment natation où l'on ne porte pas de montre quand on est nageur).",5,0,0,0,1,fr,Garmin Connect
"Un plantage lors d'une synchronisation, pour le reste ça fait le job !",3,0,1,0,0,fr,Garmin Connect
Moyen temps de mise en place long,3,0,0,0,1,fr,Garmin Connect
Je n'arrive pas a me connecter Bluetooth,2,0,1,0,0,fr,Garmin Connect
"Comme tous le monde, depuis la dernière MAJ, vivoactive HR ne se synchronisait plus. j ai fait appel au support, qui m a donné une procedure de reset usine qui a réglée le prb de synchro. il ne reste que les difficultés de connexion bluetooth, peut mieux faire...",1,0,1,0,0,fr,Garmin Connect
facilement connecté et données très completes,5,0,0,0,1,fr,Garmin Connect
"Bonjour. Depuis les dernières mises à jour, je rencontre un problème lié au live Track sur mon edge 520. Sur le lien, du mail envoyé pour suivre l'activité, il n'y a pas de signal, et donc pas de suivi de l'activité. Merci",2,0,1,0,0,fr,Garmin Connect
Avant connecté à iphone 5c sans problème. Depuis que je suis passé sur huawei p8 lite impossible de connecter ma montre. Garmin me dit que ça vient de Huawei et Huawei de Garmin ... bref  ça ne fait pas avancer les choses !!,1,1,1,0,0,fr,Garmin Connect
"Bonne appli, petit défaut qui est le calcul en temps réel.",4,0,0,1,0,fr,Garmin Connect
Très bonne application!,5,0,0,0,1,fr,Garmin Connect
Supet,5,0,0,0,1,fr,Garmin Connect
Aberrant de faire des applis aussi nulles... Obligé d'être connecté de partout pour synchroniser. Si on a pas de data on ne peut pas consulter ses activités. La prochaine fois je prend une autre marque.,1,2,1,0,0,fr,Garmin Connect
super pratique et simple a utiliser... complète (pour ma part),4,0,0,0,1,fr,Garmin Connect
Depuis la mise a jours d'hier ma montre ne se synchronise plus avec l'application,2,3,1,0,0,fr,Garmin Connect
Application complète et bien faite,5,0,0,0,1,fr,Garmin Connect
L'appli en sois est très bien conçu et plutôt claire et très complète. Le seul bémols pour moi et la non compatibilité complète avec les téléphone Huawei. Le Bluetooth se deconnecte régulièrement et on ne peux recevoir des notification uniquement si l'application et ouverte se qui n'étais pas le cas avec mon ancien téléphone.,3,0,1,1,0,fr,Garmin Connect
Works really well with fenix5 connexion is fast. But with a Garmin vivoactive hr it was really slow,5,0,0,0,1,fr,Garmin Connect
Je retire tout les commentaires positifs que j'ai laisser.Depuis la mise à jour du 3 Novembre ma montre ne veux plus de connecter avec mon Huawei P9 lite.Résultat ma montre ne me sert à rien 😡.J'ai changé mon téléphone pour un Samsung et maintenant ça fonctionne très bien 👍,4,1,1,0,0,fr,Garmin Connect
Efficace. Très utile. L interface pourrait être plus maniable,5,0,0,1,0,fr,Garmin Connect
Incroyable compagnon de route avec une fonction GPS pas comprise et un affichage en km/h manquant,4,0,0,1,0,fr,Garmin Connect
"Après mon problème d’écran noir à la connexion de garmin connect mobile(PB résolu) maintenant un problème d'altimètre viens d'apparaitre, je me suis retrouvé à plus de 8000m d'altitude hier soir et ce matin j'étais à -60m chercher l'erreur, j'ai ni gravi l’Everest, ni fais de plonger!!!! çà commence à faire beaucoup pour une montre neuve et à ce prix là!!!! Y-a-t'il une mise à jour à venir pour régler c'est Pb une bonne fois pour toutes!!???",1,5,1,0,0,fr,Garmin Connect
Telechargement direct strava live ne fonctionne plus,1,0,1,0,0,fr,Garmin Connect
Les versions se suivent et se ressemblent. Toujours plus de fonctionnalités inutiles. Toujours pas de correctifs aux bugs signalés.,1,1,0,0,1,fr,Garmin Connect
Super,5,0,0,0,1,fr,Garmin Connect
Update : depuis la dernière mise a jour apparaît d'ancienne notifications  de sms. Seul moyen : paramètres puis notification intelligentes puis  désactiver et réactiver SMS. C'est gênant. / je l'utilise avec la  vivoactive hr et franchement elle est super pratique simple et complète. Ma  femme a une polar et l'application est moins bien. J'utilise aussi  l'application pour les calories. C'est nickel.,5,16,1,0,0,fr,Garmin Connect
App vraiment bien faite et agréable à consulter.,5,0,0,0,1,fr,Garmin Connect
"Très bien, MAIS, c'était mieux avant, quand je pouvais coupler la montre!!!   Merci de résoudre le pb au plus vite, ça dure depuis trop longtemps. NB: le pb ne vient pas du téléphone comme j'ai cru lire, il se connecte très bien avec tout le reste.... C'est la montée de version Android qui n'a pas été prise en compte chez Garmin",3,26,1,0,0,fr,Garmin Connect
"Simple et efficace, l'application correspond amplement à mes attentes 👏 !",5,0,0,0,1,fr,Garmin Connect
Bon produit avec  garmin 935 rien à redire !,5,0,0,0,1,fr,Garmin Connect
ok,5,0,0,0,1,fr,Garmin Connect
Application pas aussi complète que décrit dans le manuel vivosmart hr. Pas de réglage du rétro-éclairage..... etc. Peut être bientôt ???,3,0,0,1,0,fr,Garmin Connect
Appli qui fonctionnait très bien. Changement de téléphone (Samsung A8) et les notifications intelligentes ne fonctionnent plus. Très déçue de constater que cest le cas pour beaucoup de monde au prix de la montre et du telephone on s'attend à pouvoir utiliser toutes les fonctionnalités..... ---> MAJ problème réglé : pour ceux qui ont le même problème il faut aller dans Paramètres > Sécurité > autres paramètres de sécurité > accès aux notifications Merci Jérôme Trapp pour l'astuce ! :),5,13,1,0,0,fr,Garmin Connect
"Bonne appli, lisible et facile d'accès",5,0,0,0,1,fr,Garmin Connect
"Intuitive, précis bon appui pour les entraînements",5,0,0,0,1,fr,Garmin Connect
Doesn't detect my vivofit! !,1,1,1,0,0,fr,Garmin Connect
Merci connexion avec ma fenix 3 hr et mon Samsung galaxy S6 revenue !,5,6,0,0,1,fr,Garmin Connect
Belle et parfaite,5,0,0,0,1,fr,Garmin Connect
Permet de suivre sa fréquence sans forcer,4,0,0,0,1,fr,Garmin Connect
"Application très pratique et très simple d'utilisation. Une fois la montre couplée pour la première fois, tout se fait automatiquement. Néanmoins, depuis quelques temps, les données d'altitude sont totalement faussées !",3,6,1,0,0,fr,Garmin Connect
Super  application 'merci garmin,5,0,0,0,1,fr,Garmin Connect
Excellent,5,0,0,0,1,fr,Garmin Connect
"c'est de pire en pire Garmin , vos appareils sont intuitifs mais vos serveurs et applis ne le sont pas du tout. ca devient tres difficile de mettre a jour les compteurs et les montres , ca se deconnecte sans que l'on demande quoi que ce soit ca devient penible , faite preuve de bon sens sinon la concurrence va s'en charger.",1,22,1,0,0,fr,Garmin Connect
Intuitive et facile à utiliser. Il manque que les heures de début et de fin des activités ainsi que le cumul en dénivelé positif cumulés sur une course.,4,0,0,1,0,fr,Garmin Connect
Manque d'activité comme foot,4,0,0,1,0,fr,Garmin Connect
Bien.  Pas encore parfait,4,0,0,0,1,fr,Garmin Connect
Bonjour je n ai  plus les notif appel sur ma vivosmarth hr. Ma configuration est bonne puisque ca fonctionnait avant,2,1,1,0,0,fr,Garmin Connect
J'adore,5,0,0,0,1,fr,Garmin Connect
2 semaines que j'ai la forerunner 220 et je n arrive pas souvent à synchroniser la montre avec le téléphone. ... je pensai que la mise à jour de ce matin changerai la donne. J'ai réussi à synchroniser une foi et puis plus rien. ...un peu déçu quand même. ..faites quelque chose garmin ! !!!,2,0,1,0,0,fr,Garmin Connect
Depuis la nouvelle mise à jour déconnexion et reconnexion aléatoire sur mon Motorola E ...,1,0,1,0,0,fr,Garmin Connect
"L'application c'est la moitié de la montre connecté... cette appli est triste, pas claire du tout ... elle ne donne pas du tout envie d'aller dessus. Je regrette d'avoir quitté la principale marque concurrente (leur application est mille fois mieux) En espérant qu'elle change ... Du coup je ne me sers de la montre juste comme montre. Je ne vais jamais sur l'application. Dommage",1,2,0,0,1,fr,Garmin Connect
Comme toujours chez Garmin c'est du sérieux ...,5,0,0,0,1,fr,Garmin Connect
"Super application, complète. Cela dit pour le suivi grossesse petit bug, elle ne calcule pas bien les semaines d'aménorrhées, bien que le compte à rebours en jours soit juste (elle calcule 1 semaine de moins)",5,0,1,0,0,fr,Garmin Connect
C'est surtout la connexion permanente avec la GARMIN 735XT qui est TOP,5,1,0,0,1,fr,Garmin Connect
"Super application qui permet ""d'étudier"" ses résultats",5,0,0,0,1,fr,Garmin Connect
Très satisfait de cette application qui permet de se créer un réseau de coureurs,5,0,0,0,1,fr,Garmin Connect
Application intuitive et bien conçue. Idéale pour l'entraînement en course à pieds.,5,0,0,0,1,fr,Garmin Connect
Problème de synchronisation est résolu. Merci,5,0,0,0,1,fr,Garmin Connect
excellent,5,0,0,0,1,fr,Garmin Connect
Je ne peux plus m'en passer,5,0,0,0,1,fr,Garmin Connect
"très bonne application, une simple synchronisation avec la montre et on apprend tout se qu'il nous faut sur nos activités",5,0,0,0,1,fr,Garmin Connect
